Titre;URL;Prix;Date
REAL BOUT 1 BOXED NEO GEO AES JAP IMPORT!;https://www.ebay.fr/itm/277992878777;€400;2026-06-08
SNK Neo Geo AES Fatal Fury Real Bout boxed Japan game US Seller;https://www.ebay.fr/itm/277979892325;€342;2026-06-06
Neo Geo AES Real Bout Fatal Fury Special Game Software SNK;https://www.ebay.fr/itm/405732278565;€520;2026-06-04
REAL BOUT FATAL FURY SPECIAL SOFTBOX soft box Neo Geo AES / MVS neogeo;https://www.ebay.fr/itm/224021855328;€36;2026-06-02
REAL BOUT FATAL FURY SPECIAL NEO GEO AES JAPAN BOX USED ORIGINAL;https://www.ebay.fr/itm/326274369725;€550;2026-05-23
REAL BOUT FATAL FURY SPECIAL Neo Geo AES NEOGEO SNK;https://www.ebay.fr/itm/357602896859;€788;2026-05-23
Neo Geo REAL BOUT FATAL FURY Neogeo AES SNK;https://www.ebay.fr/itm/358579634087;€433;2026-05-21
Neo Geo REAL BOUT FATAL FURY SPECIAL Neogeo AES REG CARD;https://www.ebay.fr/itm/358533634361;€693;2026-05-19
Neo Geo AES Real Bout Fatal Fury Special Japanese Version Box;https://www.ebay.fr/itm/326733802398;€377;2026-05-14
Real Bout Fatal Fury NEO GEO AES manual;https://www.ebay.fr/itm/366319211706;€15;2026-05-14
Neo Geo REAL BOUT FATAL FURY SPECIAL Neogeo AES;https://www.ebay.fr/itm/358083689699;€650;2026-05-13
Neo Geo AES FATAL FURY REAL BOUT 2 THE NEWCOMERS NEOGEO AES REG CARD.;https://www.ebay.fr/itm/358083842939;€780;2026-05-12
SNK Neo Geo Real Bout Fatal Fury Japan Edition -1996 Japan Garou densetsu;https://www.ebay.fr/itm/187017526451;€289;2026-05-07
Neo Geo REAL BOUT FATAL FURY SPECIAL Neogeo AES REG CARD.;https://www.ebay.fr/itm/358083878411;€658;2026-05-02
REAL BOUT FATAL FURY SPECIAL NEO GEO AES SNK FREE SHIPPING JAPAN Ref 0501;https://www.ebay.fr/itm/363475866282;€606;
Real Bout Fatal Fury Special NEO GEO AES manual;https://www.ebay.fr/itm/366319292672;€15;
SNK Neo Geo ROM Aes Real Bout Fatal Fury 2 THE NEWCOMERS jeu d'action Japon 1998;https://www.ebay.fr/itm/257464497090;€406;
Neo Geo AES Real Bout Fatal Fury Special Version Japonaise Boîte avec Manuel F/S;https://www.ebay.fr/itm/257464490002;€399;
Neo Geo REAL BOUT FATAL FURY Neogeo AES SNK;https://www.ebay.fr/itm/358083630315;€373;
BOXED REAL BOUT NEO GEO AES 2ND RUN WITH GOLD WARNING LABEL JAP IMPORT!;https://www.ebay.fr/itm/277916236391;€350;
REAL BOUT FATAL FURY 2 NEO GEO AES Neogeo SNK FREE SHIPPING Ref 2416;https://www.ebay.fr/itm/365756031583;€1 040;
Fatal Fury REAL BOUT SPECIAL Japan Edition (Neo Geo AES);https://www.ebay.fr/itm/267645406946;€364;
NEO GEO AES MANUALS - MANUAL JAPAN - ネオジオ;https://www.ebay.fr/itm/365297362016;€15;2026-03-27
Neo Geo AES *Real Bout Garou Densetsu - Real Bout Fatal Fury* CIB emballage d'origine notice;https://www.ebay.fr/itm/257449676540;€216;
Real Bout Fatal Fury 2 NEO GEO AES manual;https://www.ebay.fr/itm/366319207485;€15;
Fatal Fury Real Bout Special Garou Densetsu SNK Neo Geo AES JP CIB with Manual;https://www.ebay.fr/itm/317933682704;€416;
Fatal Fury REAL BOUT SPECIAL Japan Edition (Neo Geo AES);https://www.ebay.fr/itm/257389931225;€264;2026-03-14
Real Bout Fatal Fury - Neo Geo AES - NTSC-J - Japan - CIB - Komplett !;https://www.ebay.fr/itm/327160066905;€350;2026-06-04
Real Bout Fatal Fury - Neo Geo AES - NTSC-J - Japan - CIB - Komplett;https://www.ebay.fr/itm/227311956773;€280;2026-05-13
Jeu rare Fatal Fury Special Neo Geo AES Fighter Arcade;https://www.ebay.fr/itm/278002527559;€159;2026-05-26
Neo Geo FATAL FURY SPECIAL Neogeo AES SNK.;https://www.ebay.fr/itm/358633779879;€260;2026-06-04
FATAL FURY SPECIAL NEO GEO AES JAPAN BOX USED ORIGINAL;https://www.ebay.fr/itm/325614253093;€120;
FATAL FURY SPECIAL GAROU DENSETSU Neo Geo AES Neogeo JAP SNK Cartridge Complete;https://www.ebay.fr/itm/177974930882;€100;
SNK Neo Geo AES Fatal Fury spécial chariot de jeu vidéo version Japon JP;https://www.ebay.fr/itm/175632541295;€139;2026-05-02
NEO GEO AES FATAL FURY 2 FREE SHIPPING SNK Ref 2101;https://www.ebay.fr/itm/318180814789;€113;
REAL BOUT FATAL FURY SPECIAL SNK MVS NEO GEO GAME CARTRIDGE. BOSS CHIPPED.;https://www.ebay.fr/itm/135759792595;€207;2026-05-13
FATAL FURY SPECIAL FOR NEO GEO AES IN CARTRIDGE JAPANESE VERSION USED COMPLETE;https://www.ebay.fr/itm/405230703421;€90;2026-03-19
FATAL FURY SPECIAL NEO GEO AES SNK FREE SHIPPING Ref 2201;https://www.ebay.fr/itm/366359694160;€225;2026-05-21
Neo Geo AES SNK FATAL FURY / GAROU Neogeo AES;https://www.ebay.fr/itm/358583427766;€303;2026-06-10
Neo Geo FATAL FURY SPECIAL Neogeo AES SNK.;https://www.ebay.fr/itm/358084134227;€113;
Jeu Neo Geo AES Fatal Fury 2 CIB Complet USA Original 100%;https://www.ebay.fr/itm/188058599652;€180;2026-05-28
Neo Geo AES SNK FATAL FURY / GAROU Neogeo AES.;https://www.ebay.fr/itm/358208849137;€260;
NEO GEO AES Garou Densetsu 2 Fatal Fury 2 NTSC Jap avec notice SNK;https://www.ebay.fr/itm/168323131828;€65;
Neo Geo AES SNK FATAL FURY / GAROU Neogeo AES;https://www.ebay.fr/itm/358082978839;€303;
Neo Geo FATAL FURY SPECIAL Neogeo AES SNK;https://www.ebay.fr/itm/358375173978;€130;
Snk Neo Geo aes Fatal Fury special;https://www.ebay.fr/itm/389993498876;€99;2026-05-08
Neo Geo AES SNK FATAL FURY / GAROU Neogeo AES;https://www.ebay.fr/itm/358530965468;€347;2026-05-21
NEO GEO AES FATAL FURY 3 Garou Densetsu Ref 0716 SNK FREE SHIPPING;https://www.ebay.fr/itm/304176189031;€191;2026-05-05
Neo Geo SNK FATAL FURY 3 Neogeo AES SNK;https://www.ebay.fr/itm/358530947557;€303;2026-05-21
SNK NEO GEO CD NGCD Real Bout Fatal Fury Japanese version boxed🟪;https://www.ebay.fr/itm/326324448627;€11;2026-06-06
FATAL FURY SPECIAL SNK NEO GEO NEOGEO AES RARE JAPAN 1993 USED;https://www.ebay.fr/itm/397925475846;€170;2026-05-08
Neo Geo FATAL FURY 2 Neogeo AES SNK.;https://www.ebay.fr/itm/358580433443;€260;2026-05-22
FATAL FURY SPECIAL NEO GEO AES SNK FREE SHIPPING Ref 1375;https://www.ebay.fr/itm/315952927447;€104;
Real Bout Fatal Fury Neo Geo CD Anglais Euro USA Complet SNK;https://www.ebay.fr/itm/306690633115;€72;
Neo Geo SNK FATAL FURY 3 Neogeo AES SNK.;https://www.ebay.fr/itm/358082900569;€243;
REAL BOUT FATAL FURY 2 THE NEWCOMERS SNK MVS NEO GEO GAME CARTRIDGE.;https://www.ebay.fr/itm/146560101394;€219;2026-05-07
FATAL FURY 2 SNK NEO GEO NEOGEO AES RARE JAPAN 1992;https://www.ebay.fr/itm/396369396231;€90;
Fatal Fury Garou Densetsu Special 1993 Case Manual Neo Geo AES Japan Vintage;https://www.ebay.fr/itm/336554420825;€78;
Neo Geo FATAL FURY 2 Neogeo AES SNK.;https://www.ebay.fr/itm/358368212884;€139;
FATAL FURY 2 NO MANUAL NEO GEO AES USA USED TESTED ORIGINAL GAME;https://www.ebay.fr/itm/324368886684;€200;2026-05-13
Fatal Fury Special Neo Geo AES;https://www.ebay.fr/itm/147281586211;€87;
NG NEOGEO AES ROM FATAL FURY 3 JPN IMPORT GOOD CONDITION;https://www.ebay.fr/itm/265467480699;€230;2026-06-10
FATAL FURY SPECIAL SNK NEO GEO NEOGEO AES JAPAN 1993 USED *AS PHOTO;https://www.ebay.fr/itm/397947704067;€190;2026-05-28
NEO GEO MVS REAL BOUT FATAL FURY 2 JAPAN AVEC BOITE CHOC;https://www.ebay.fr/itm/188414691586;€174;2026-05-28
FATAL FURY THE BATTLE OF DESTINY NEO GEO AES SNK NEOGEO;https://www.ebay.fr/itm/147022240395;€199;2026-05-03
FATAL FURY 2 NEO GEO AES JAPAN BOX USED ORIGINAL;https://www.ebay.fr/itm/364774359507;€140;
FATAL FURY SPECIAL SNK NEO GEO NEOGEO AES JAPAN 1993 USED NO MANUAL *AS PHOTO;https://www.ebay.fr/itm/236811011909;€160;2026-05-15
Neo Geo AES - Fatal Fury Special (JAPON / JPN / JP);https://www.ebay.fr/itm/327094723559;€93;
REAL BOUT FATAL FURY SPECIAL Neo Geo CD 3079 nc;https://www.ebay.fr/itm/304480616122;€39;2026-03-27
Neo Geo CD REAL BOUT FATAL FURY Spine * 0782 nc;https://www.ebay.fr/itm/311751092050;€30;
NEO GEO AES FATAL FURY SPECIAL US VERSION;https://www.ebay.fr/itm/318279961223;€234;2026-05-11
Real Bout Fatal Fury Neo Geo CD Japan JPN Arcade Fighter avec manuel, colonne vertébrale;https://www.ebay.fr/itm/277673968469;€29;2026-05-20
VINTAGE SNK NEO-GEO AES FATAL FURY SPECIAL CARTRIDGE VIDEO GAME JAPAN;https://www.ebay.fr/itm/358538864290;€90;2026-05-10
